{
  "schema_version": 1,
  "id": "card0001",
  "entity_type": "card",
  "title": "Research notes",
  "created": "2026-10-28T10:20:00Z",
  "updated": "2026-10-28T10:20:00Z",
  "card_type": "note",
  "created_by_work_id": "work0001",
  "source_work_ids": ["work0002"],
  "source_asset_ids": ["asset001", "asset002"],
  "source_card_ids": [],
  "evidence": [
    {
      "id": "ev1",
      "asset_id": "asset001",
      "text_normalization": "html_text_v1",
      "selector": {
        "type": "TextQuoteSelector",
        "exact": "A quote",
        "prefix": "Some ",
        "suffix": " from the page"
      },
      "position_selector": {
        "type": "TextPositionSelector",
        "start": 5,
        "end": 12
      }
    }
  ],
  "body": "A note with reference [^ev1]."
}
